"sentence","target word","cloze probability","Log Hal Frequency","Phonological Neighbors","Semantic Neighborhood Density","Response Entropy","densityA","densityB"
"More than anything she wanted to be his __________.","wife","0.3700","10.57","13","0.67","2.5900","228","14"
"Nate proclaimed he was lucky that Sarah was his __________.","wife","0.3500","10.57","13","0.67","2.6100","228","14"
"Samantha enjoyed the smell of her new __________.","car","0.5000","11.37","21","0.67","2.8300","274","18"
"There was not room for the triplets in the __________.","car","0.3400","11.37","21","0.67","3.5200","274","18"
"The youngest daughter would get the house and the __________.","car","0.7300","11.37","21","0.67","1.8000","274","18"
"Danielle thanked her husband for buying her a new __________.","car","0.5500","11.37","21","0.67","2.8800","274","18"
"Animals ate the jam because Mitch didn't replace the __________.","lid","0.6200","7.97","24","0.51","2.5400","19","21"
"Martha covered the boiling pot with a __________.","lid","0.8800","7.97","24","0.51","0.8100","19","21"
"Every day he poured his drink into the same __________.","glass","0.4800","9.94","5","0.65","1.8400","99","4"
"Michelle went to the sink and filled up her __________.","glass","0.5300","9.94","5","0.65","2.0700","99","4"
"When pouring the drink, the bartender overfilled the __________.","glass","0.8200","9.94","5","0.65","1.0400","99","4"
"Looking for local beer, people walked to the __________.","bar","0.3700","10.36","26","0.67","2.4100","82","17"
"David watched games with his friends at the local __________.","bar","0.5300","10.36","26","0.67","1.8900","82","17"
"During happy hour, the employees visited the __________.","bar","0.8800","10.36","26","0.67","0.8800","82","17"
"On the weekend, Chad spends his evenings at the __________.","bar","0.3900","10.36","26","0.67","3.4200","82","17"
"Paul wanted a beer, so he walked to the __________.","bar","0.5200","10.36","26","0.67","1.7300","82","17"
"The waves were very loud as they hit the __________.","shore","0.6000","8.72","34","0.63","2.0700","61","23"
"The sailors couldn't wait to get back to __________.","shore","0.5400","8.72","34","0.63","2.3500","61","23"
"After weeks at sea the bottle washed up onto __________.","shore","0.8300","8.72","34","0.63","1.0500","61","23"
"While swimming, the couple discovered dolphins near the __________.","shore","0.3300","8.72","34","0.63","3.4300","61","23"
"Isaiah loved to see the wild eagles __________.","fly","0.5000","10.29","13","0.65","1.6500","33","9"
"After its injury, the small bird could no longer __________.","fly","0.9700","10.29","13","0.65","0.2200","33","9"
"Spectators at the zoo hoped to see the eagle __________.","fly","0.6600","10.29","13","0.65","1.9700","33","9"
"Thousands of feet in the air the jet would __________.","fly","0.3700","10.29","13","0.65","3.6000","33","9"
"The soccer player swatted at an annoying __________.","fly","0.7400","10.29","13","0.65","1.5100","33","9"
"After the marathon, Kelly dined at a buffet to __________.","eat","0.3200","10.48","12","0.61","3.3800","61","11"
"Oliver liked to put bread in his soup to __________.","eat","0.4700","10.48","12","0.61","2.6000","61","11"
"The dinner party host didn't provide enough food to __________.","eat","0.4600","10.48","12","0.61","2.8400","61","11"
"The frazzled mother gave her son candy to __________.","eat","0.4200","10.48","12","0.61","3.8500","61","11"
"Jo can never decide what food to __________.","eat","0.6200","10.48","12","0.61","2.1000","61","11"
"Karen's son started crying when he needed to __________.","eat","0.3100","10.48","12","0.61","3.1200","61","11"
"The Italian restaurant was his favorite place to __________.","eat","0.7300","10.48","12","0.61","1.1600","61","11"
"The baby was cranky when she didn't __________.","eat","0.4200","10.48","12","0.61","2.1800","61","11"
"Connor was hungry from his trip and excited to __________.","eat","0.8600","10.48","12","0.61","1.1000","61","11"
"Although he was hungry, Pablo couldn't decide where to __________.","eat","0.8300","10.48","12","0.61","0.8700","61","11"
"Gabe didn't know which one of his desserts to __________.","eat","0.5200","10.48","12","0.61","2.8500","61","11"
"At dinner the rolls were her favorite thing to __________.","eat","0.9100","10.48","12","0.61","0.6500","61","11"
"The baby started to cry because it had to __________.","eat","0.4200","10.48","12","0.61","2.7700","61","11"
"If corn isn't ready it will be hard to __________.","eat","0.4300","10.48","12","0.61","2.6400","61","11"
"The men wanted to fish but they had no __________.","bait","0.5000","8.36","38","0.51","2.7600","2","29"
"The police lured the robbers by using jewelry as __________.","bait","0.9400","8.36","38","0.51","0.4800","2","29"
"The novice fishermen didn't choose the right __________.","bait","0.3800","8.36","38","0.51","2.9700","2","29"
"The fisherman loved spending his days on his __________.","boat","0.9000","9.67","31","0.65","0.8200","72","27"
"While at sea, David noticed a hole in the __________.","boat","0.5500","9.67","31","0.65","2.2700","72","27"
"Dave traveled across the Atlantic Ocean in his new __________.","boat","0.6000","9.67","31","0.65","1.7900","72","27"
"The fisherman was interested in buying a new __________.","boat","0.4700","9.67","31","0.65","2.3000","72","27"
"With no road between the islands you'll need a __________.","boat","0.8000","9.67","31","0.65","1.2900","72","27"
"Elise rode across the massive bay on a __________.","boat","0.3600","9.67","31","0.65","3.5800","72","27"
"The hurricane that hit the harbor destroyed the man's __________.","boat","0.5100","9.67","31","0.65","1.9500","72","27"
"The fisherman was happy when he caught a __________.","fish","0.5300","10.33","12","0.65","2.4500","35","9"
"The tourist said the coastal town smelled like __________.","fish","0.6000","10.33","12","0.65","2.3900","35","9"
"The aquarium in the child's room housed his pet __________.","fish","0.3900","10.33","12","0.65","2.9900","35","9"
"While camping, the father and son duo like to __________.","fish","0.5900","10.33","12","0.65","2.2600","35","9"
"Anthony was in a situation where he had no __________.","choice","0.5000","11.09","4","0.68","2.9200","113","3"
"Rachel outsmarted her three friends using her impressive __________.","skills","0.3400","11.30","9","0.65","3.4800",\N,\N
"The fisherman trapped hundreds of sharks in their __________.","nets","0.8200","8.14","18","0.55","1.2500",\N,\N
"Imran couldn't understand why everyone was in a __________.","hurry","0.3300","8.54","6","0.45","3.7700","36","11"
"Work started in ten minutes, so Jim had to __________.","hurry","0.8000","8.54","6","0.45","1.1200","36","11"
"George sprinted out the door because he was in a __________.","hurry","0.8700","8.54","6","0.45","0.6100","36","11"
"Unfortunately the cake had stuck to the __________.","pan","0.6800","9.22","27","0.61","1.8600","16","25"
"The chef sprayed the cooking spray onto the __________.","pan","0.9200","9.22","27","0.61","0.6200","16","25"
"Becca was disappointed that the free trip was a __________.","scam","0.3600",\N,\N,\N,"3.5300",\N,\N
"Zoe realized the fake lottery ticket was a __________.","scam","0.3700",\N,\N,\N,"3.4300",\N,\N
"It is important not to donate to a __________.","scam","0.3900",\N,\N,\N,"3.7300",\N,\N
"The email offer for a free car was a __________.","scam","0.6700",\N,\N,\N,"2.0100",\N,\N
"Don't answer an email that appears to be a __________.","scam","0.6100",\N,\N,\N,"2.3000",\N,\N
"The phone call about a free cruise was a __________.","scam","0.6400",\N,\N,\N,"2.0100",\N,\N
"Ray immediately knew the salesman's offer was a __________.","scam","0.3200",\N,\N,\N,"3.5600",\N,\N
"Winston's first attempt at sewing was sadly a complete __________.","disaster","0.4000","9.01","0","0.63","1.9700","26","0"
"No one knew that Anne's marriage was really a __________.","sham","0.6600","6.92","19","0.41","2.2000","1","13"
"The little girl knew her friend had told a __________.","lie","0.8900","10.00","30","0.63","0.6800","59","21"
"Grace always knew when her sister was telling a __________.","lie","0.9200","10.00","30","0.63","0.5400","59","21"
"The daughter felt guilty after telling her parents a __________.","lie","0.9300","10.00","30","0.63","0.4900","59","21"
"Cam knew the reality show was actually a __________.","fake","0.3200","8.97","21","0.61","3.5900","10","19"
"The sitcom repeatedly used the same running __________.","joke","0.4300","9.92","15","0.59","2.6200","22","10"
"No one laughed because they didn't get the __________.","joke","0.9400","9.92","15","0.59","0.4400","22","10"
"He's not often serious, he loves to __________.","joke","0.7900","9.92","15","0.59","1.3200","22","10"
"Always stoic and serious, Peter was not one to __________.","joke","0.5900","9.92","15","0.59","2.6000","22","10"
"Meredith laughed loudly when she heard the funny __________.","joke","0.6800","9.92","15","0.59","1.5400","22","10"
"Megan couldn't stop laughing from the funny __________.","joke","0.7700","9.92","15","0.59","1.6900","22","10"
"Vince was offended but it was only a __________.","joke","0.7000","9.92","15","0.59","2.0900","22","10"
"The comedy show ended with a really good __________.","joke","0.5400","9.92","15","0.59","2.5900","22","10"
"Hazel recognized her cat from afar because of its __________.","color","0.3300","11.22","9","0.66","3.3700","141","4"
"After the campfire, the wood had a dark __________.","color","0.3300","11.22","9","0.66","3.9500","141","4"
"The room was depressing and needed much more __________.","color","0.4900","11.22","9","0.66","2.5500","141","4"
"Tired of overgrown branches, Jackie used her saw to __________.","cut","0.3400","11.50","25","0.68","2.7400","192","23"
"The landscaper went to the branch and started to __________.","cut","0.3600","11.50","25","0.68","2.6700","192","23"
"Tom carefully searched for a bolt of the right __________.","size","0.5600","11.58","31","0.66","2.7500","138","10"
"I returned the dress because it was the wrong __________.","size","0.8700","11.58","31","0.66","0.7100","138","10"
"The football practice was canceled due to extreme __________.","weather","0.5300","9.97","7","0.65","1.7700","355","6"
"When Simon tore his pants, there was a loud __________.","rip","0.6900","8.99","31","0.56","1.7400","6","28"
"The dog ran inside just before it started to __________.","rain","0.8200","9.79","40","0.63","1.2700","80","28"
"The couple's trip was ruined when it began to __________.","rain","0.8500","9.79","40","0.63","0.9300","80","28"
"The weatherman announced that the day would have heavy __________.","rain","0.7300","9.79","40","0.63","1.6800","80","28"
"The door caught the dress and created a huge __________.","tear","0.5300","8.80","37","0.57","1.7400",\N,\N
"Some clothing types don't last long because they easily __________.","tear","0.4400","8.80","37","0.57","2.9700",\N,\N
"The couple needed an apartment at a good __________.","price","0.7300","11.94","6","0.67","1.3800","108","7"
"No one could buy the book because of the __________.","price","0.6000","11.94","6","0.67","2.7500","108","7"
"The contractor offered the couple a fair __________.","price","0.7000","11.94","6","0.67","1.4500","108","7"
"Art Deco architecture is no longer in __________.","style","0.6800","10.67","9","0.68","1.6900",\N,\N
"In fashion history, long hair seems to stay in __________.","style","0.6600","10.67","9","0.68","1.6500",\N,\N
"At one period, the flapper dress was in __________.","style","0.6000","10.67","9","0.68","2.6400",\N,\N
"The lady's dress was decorated with delicate __________.","lace","0.3200","8.10","27","0.50","3.2200","7","25"
"Cats shed a lot and leave around balls of __________.","fur","0.6300","8.44","10","0.58","1.1900",\N,\N
"The baby animal's body was covered in __________.","fur","0.3400","8.44","10","0.58","3.6000",\N,\N
"Because of clouds, it was impossible to see the __________.","sun","0.6400","11.21","31","0.67","2.0700",\N,\N
"It was so cloudy outside Joseph couldn't see the __________.","sun","0.3600","11.21","31","0.67","3.1400",\N,\N
"Sarah won't swim if the water is too __________.","cold","0.7200","10.46","23","0.66","1.4100","171","11"
"The child wouldn't swim, because the pool was too __________.","cold","0.5000","10.46","23","0.66","1.4500","171","11"
"They didn't stop working until the sun had __________.","set","0.7900","12.57","27","0.70","1.3700","414","24"
"The couple sat for dinner once the table was __________.","set","0.6300","12.57","27","0.70","1.8200","414","24"
"The baker got bored waiting for the pudding to __________.","set","0.5000","12.57","27","0.70","2.7600","414","24"
"They searched for the thief but he was already __________.","gone","0.9500","10.86","19","0.66","0.3800","195","14"
"Holly was sent to a timeout until she calmed __________.","down","1.0000","12.59","19","0.69","0.0000","895","17"
"When the market crashed, many stores' profits went __________.","down","0.8700","12.59","19","0.69","0.9600","895","17"
"At the end of dinner, Jason picked up the __________.","tab","0.4000","9.13","14","0.50","2.7400","1","15"
"At almost every local bar Frank has a __________.","tab","0.3900","9.13","14","0.50","3.1700","1","15"
"To visit a different site just open a new __________.","tab","0.4700","9.13","14","0.50","2.5600","1","15"
"The chef was known for his fragrant and flavorful __________.","dishes","0.3800","8.14","4","0.56","3.6100",\N,\N
"For the client dinner, the company will pay the __________.","bill","0.6000","11.67","34","0.68","2.0100","143","28"
"The teenager was shocked by the expensive room service __________.","bill","0.4900","11.67","34","0.68","2.9100","143","28"
"With clothes scattered everywhere, her room was a __________.","mess","0.9100","9.49","21","0.56","0.5500","22","17"
"Jill cried and said her life had become a __________.","mess","0.4000","9.49","21","0.56","3.1600","22","17"
"Molly hoped that the kids wouldn't make a __________.","mess","0.4400","9.49","21","0.56","1.9100","22","17"
"Kara asked the kids not to make a __________.","mess","0.5500","9.49","21","0.56","2.3000","22","17"
"Christine knew she would be coming home to a __________.","mess","0.6500","9.49","21","0.56","2.2900","22","17"
"Don's lazily constructed birdhouse was a total __________.","mess","0.3500","9.49","21","0.56","2.5000","22","17"
"A fan of stringed instruments, the musician played the __________.","violin","0.3800","7.86","0","0.59","2.4100","11","0"
"The blood drive had many volunteers willing to __________.","donate","0.7500","7.99","1","0.52","1.3600","3","0"
"Advice can be hard to receive and easy to __________.","give","0.7100","12.35","6","0.69","1.7000","391","7"
"They loved getting gifts but they didn't like to __________.","give","0.5100","12.35","6","0.69","2.7700","391","7"
"Growing up with three siblings he learned to __________.","share","0.4000","10.96","30","0.67","2.9600","98","20"
"A selfish, stingy person, Devon never liked to __________.","share","0.7300","10.96","30","0.67","1.7100","98","20"
"Jane borrowed money but could not repay her __________.","debt","0.4800","9.56","22","0.62","2.3500","13","24"
"After college, the student had amassed a lot of __________.","debt","0.7600","9.56","22","0.62","1.5600","13","24"
"When Lana finished school she had a lot of __________.","debt","0.4100","9.56","22","0.62","3.6100","13","24"
"The generous boy always racked up a large __________.","debt","0.3100","9.56","22","0.62","3.2100","13","24"
"The struggling business had a great deal of __________.","debt","0.5800","9.56","22","0.62","2.9000","13","24"
"The fencer ended the fight with a final __________.","blow","0.3100","9.74","10","0.61","3.2000","33","7"
"The wolf blew the house down with one final __________.","blow","0.4600","9.74","10","0.61","2.0800","33","7"
"At the landfill, Fred cut himself on a rusty __________.","nail","0.6600","8.43","34","0.55","1.9200","6","23"
"Nicole hung the wall painting using a small __________.","nail","0.6900","8.43","34","0.55","1.6500","6","23"
"The assistant shouted in pain after stepping on a __________.","nail","0.5000","8.43","34","0.55","2.4800","6","23"
"Use tools to remove the lid from a tin __________.","can","0.9000","14.30","27","0.69","0.7500","1772","27"
"The poor boy stored his earnings in a metal __________.","can","0.3600","14.30","27","0.69","2.8300","1772","27"
"The lazy girl ate soup straight out of the __________.","can","0.8000","14.30","27","0.69","1.0800","1772","27"
"Patrick managed to fix the sink after replacing a __________.","pipe","0.4500","9.41","17","0.61","2.7200","20","17"
"In the evening grandpa smokes using his __________.","pipe","0.9600","9.41","17","0.61","0.3200","20","17"
"The street was flooded, because there was a broken __________.","pipe","0.5000","9.41","17","0.61","2.6000","20","17"
"The rain was quite loud because the roof was __________.","tin","0.6100","9.38","31","0.60","1.4900","12","25"
"While preparing the meal, the chef couldn't find his __________.","knife","0.4100","8.87","9","0.59","3.0800","76","7"
"Be careful not to cut yourself with the __________.","knife","0.8300","8.87","9","0.59","1.0300","76","7"
"While cooking, Luke accidentally cut himself with a __________.","knife","0.9600","8.87","9","0.59","0.3000","76","7"
"The landscaper cleared the lawn of leaves with the __________.","rake","0.5400","6.82","33","0.41","1.3700","11","26"
"The audio was normal but the video had a __________.","glitch","0.3700",\N,\N,\N,"3.6500",\N,\N
"When her contacts lenses are dry her vision will __________.","blur","0.6200","7.40","5","0.49","2.3800","3","3"
"The breeze felt good when it blew along his __________.","face","0.4900","11.26","20","0.68","2.9100","371","18"
"The girl was embarrassed and tried to hide her __________.","face","0.4300","11.26","20","0.68","2.9700","371","18"
"The young woman had a very recognizable __________.","face","0.4400","11.26","20","0.68","2.5900","371","18"
"None of the witnesses could describe the suspect's __________.","face","0.5000","11.26","20","0.68","2.4100","371","18"
"Before going to bed, Kat always washes her __________.","face","0.5900","11.26","20","0.68","1.5300","371","18"
"Billy couldn't believe Max hit him in the __________.","face","0.3300","11.26","20","0.68","3.2500","371","18"
"After straining his head, Arthur felt pain at his __________.","neck","0.6500","9.61","14","0.61","1.5500","81","13"
"The woman had heard him yelling and turned her __________.","head","0.7800","11.60","28","0.69","1.2100","424","22"
"In winter, Matt wore a hat to cover his __________.","head","0.7000","11.60","28","0.69","1.3700","424","22"
"The unstable beam struck the construction worker on the __________.","head","0.6800","11.60","28","0.69","2.1900","424","22"
"Noah started crying when the baseball hit his __________.","head","0.4100","11.60","28","0.69","3.2200","424","22"
"A stray baseball smacked an unsuspecting walker in the __________.","head","0.4500","11.60","28","0.69","2.8200","424","22"
"Bryce didn't like the taste of the apple's __________.","skin","0.4000","10.13","10","0.63","2.7400","47","11"
"Laura jumped up and shouted after burning her __________.","hand","0.5600","11.74","13","0.69","2.0500","431","9"
"Opal's new, short haircut barely covered her __________.","ears","0.4600","9.42","11","0.58","2.5800",\N,\N
"When the bomb detonated, people miles away heard the __________.","blast","0.3300","9.85","3","0.60","2.3400","15","1"
"Tim spoke loudly at the restaurant due to the __________.","noise","0.7600","9.94","10","0.63","1.5400","37","3"
"Chester couldn't hear Amy's voice over the crowded room's __________.","noise","0.5100","9.94","10","0.63","2.8800","37","3"
"I couldn't hear anything because of the __________.","noise","0.6600","9.94","10","0.63","2.2900","37","3"
"While walking through the woods, Preston heard a __________.","noise","0.3200","9.94","10","0.63","3.9000","37","3"
"The man couldn't understand her because of the __________.","noise","0.3300","9.94","10","0.63","3.2100","37","3"
"The cargo at the shipyard fell with a loud __________.","bang","0.3300","8.82","19","0.57","2.2100","7","18"
"The thunderclap shook the tree with a loud __________.","bang","0.4300","8.82","19","0.57","2.6900","7","18"
"When he got to work, the baker prepared fresh __________.","bread","0.6100","9.11","15","0.59","2.4300","42","12"
"The house filled with smells of the freshly baked __________.","bread","0.7200","9.11","15","0.59","1.4300","42","12"
"Spaghetti is the girl's favorite type of __________.","food","0.4900","11.00","18","0.67","1.8000","147","10"
"Sally's persistent cry meant she wanted more __________.","food","0.3700","11.00","18","0.67","2.5700","147","10"
"The farmer's pigs were quickly running out of __________.","food","0.5000","11.00","18","0.67","2.5600","147","10"
"After missing lunch Harry badly needed some __________.","food","0.8400","11.00","18","0.67","1.2000","147","10"
"During the road trip, the family stopped to get __________.","food","0.4000","11.00","18","0.67","2.7500","147","10"
"Katie dislikes the way some animals chew their __________.","food","0.6500","11.00","18","0.67","1.7800","147","10"
"On the road, the family stopped many times for __________.","food","0.3600","11.00","18","0.67","3.1900","147","10"
"Whenever her grandkids visit, Greta prepares lots of __________.","cookies","0.3200","7.86","2","0.49","2.8400",\N,\N
"To stay fit, Jim participates in a basketball __________.","game","0.4200","12.19","19","0.67","2.4800","123","17"
"The announcer said it would be a very close __________.","game","0.3100","12.19","19","0.67","2.2400","123","17"
"Tyler and his opponent shook hands before the __________.","match","0.5800","10.47","20","0.65","2.2500","41","14"
"The rock band celebrated after their first __________.","concert","0.3600","9.40","0","0.65","2.6400","39","0"
"Michael challenged the experienced fencer to a __________.","duel","0.8400","7.43","3","0.57","0.9600",\N,\N
"His pride injured, John challenged Robert to a __________.","duel","0.6200","7.43","3","0.57","1.8100",\N,\N
"Eric was confident and challenged Kevin to a __________.","duel","0.4300","7.43","3","0.57","2.3500",\N,\N
"The two wizards decided to settle things with a __________.","duel","0.5000","7.43","3","0.57","2.6700",\N,\N
"Taylor's leg was tingling due to damage of a __________.","nerve","0.8600","8.34","6","0.57","1.0400","12","5"
"He frowned and she knew she'd definitely struck a __________.","nerve","0.5800","8.34","6","0.57","1.3900","12","5"
"Linda's favorite genres of music were pop and __________.","rock","0.5700","10.70","29","0.67","2.3100","75","20"
"The passengers feared capsizing when the ship began to __________.","rock","0.3600","10.70","29","0.67","3.3200","75","20"
"On a stormy night, the ship captain hit a __________.","rock","0.4200","10.70","29","0.67","3.0800","75","20"
"To support the roof, Laura used a long __________.","pole","0.4200","8.65","34","0.61","2.5900","27","29"
"The tent quickly collapsed after Patrick broke a __________.","pole","0.5300","8.65","34","0.61","2.5900","27","29"
"Jane balled all the bread dough up into a __________.","ball","0.4200","10.56","30","0.66","3.2800","110","21"
"All of the wet paper had rolled into a __________.","ball","0.7300","10.56","30","0.66","1.6600","110","21"
"Tired from studying, Dan crumpled his papers into a __________.","ball","0.8000","10.56","30","0.66","1.1700","110","21"
"Jen wrapped the metal wire into a __________.","ball","0.3200","10.56","30","0.66","3.7500","110","21"
"Jason fell off his skateboard when he hit the __________.","curb","0.3400","7.62","11","0.53","3.4100","13","11"
"After hitting her head Sam had a huge __________.","bump","0.4200","7.89","10","0.49","2.5700","5","8"
"The exhausted hunters returned with a fat __________.","deer","0.4000","8.50","36","0.59","3.5400",\N,\N
"The large animal had antlers like a __________.","deer","0.5900","8.50","36","0.59","1.9000",\N,\N
"The hunter took the antlers from the dead __________.","deer","0.7100","8.50","36","0.59","1.6300",\N,\N
"The fireplace was adorned with the head of a __________.","deer","0.4700","8.50","36","0.59","2.7700",\N,\N
"The men of the family went out to hunt __________.","deer","0.6300","8.50","36","0.59","2.4300",\N,\N
"Due to the dust, the construction workers began to __________.","cough","0.7800","7.70","8","0.48","1.0500","7","7"
"During the campfire, the heavy smoke made Lance __________.","cough","0.7400","7.70","8","0.48","1.8100","7","7"
"He knew Agatha was ill when he heard her __________.","cough","0.6000","7.70","8","0.48","2.5900","7","7"
"They knew Rob was choking because he began to __________.","cough","0.3100","7.70","8","0.48","3.7500","7","7"
"One of the patient's symptoms was a persistent __________.","cough","0.7600","7.70","8","0.48","1.5700","7","7"
"While eating the peanuts Gary began to __________.","choke","0.5700","7.99","16","0.44","2.6300","9","16"
"After swallowing too quickly, Simon began to __________.","choke","0.8200","7.99","16","0.44","0.9800","9","16"
"Young children playing with small toys may potentially __________.","choke","0.6900","7.99","16","0.44","2.2400","9","16"
"The heavy box had both a large volume and __________.","weight","0.3800","10.43","30","0.65","3.3500",\N,\N
"Many women are very conscious of their __________.","weight","0.3200","10.43","30","0.65","2.8200",\N,\N
"The strict Catholic family never misses Sunday __________.","mass","0.7600","10.43","24","0.67","1.1300","110","20"
"Benjamin had trouble parking because the space was __________.","small","0.5600","11.98","3","0.69","2.0700","542","4"
"Jan dropped the lightbulb and it cracked near the __________.","base","0.4700","10.99","21","0.68","3.5600","91","20"
"The manager looked for paper but the supply was __________.","low","0.4100","11.36","30","0.68","2.6000",\N,\N
