"sentence","target word","cloze probability","Log Hal Frequency","Phonological Neighbors","Semantic Neighborhood Density","Response Entropy","densityA","densityB"
"When college ends, there is pressure to find a __________.","job","0.9500","11.93","19","0.68","0.3300","238","18"
"The college student looked for a summer __________.","job","0.7600","11.93","19","0.68","1.6200","238","18"
"Ronald went out everyday to search for a __________.","job","0.4600","11.93","19","0.68","3.6200","238","18"
"Their garage band had finally gotten a real __________.","gig","0.5500","8.83","11","0.57","2.7500","1","11"
"Macy had planned meticulously, leaving nothing to __________.","chance","0.8000","10.99","5","0.66","1.5700","131","7"
"Although they had met before, Lee couldn't remember his __________.","name","0.9500","12.60","15","0.69","0.3800","294","14"
"The man introduced himself by stating his __________.","name","0.9400","12.60","15","0.69","0.4300","294","14"
"When Michael turned eighteen he legally changed his __________.","name","0.9800","12.60","15","0.69","0.1600","294","14"
"They tried but they couldn't get the engine to __________.","start","0.8800","12.06","9","0.69","0.8100","154","4"
"To keep spirits high the miner made up a __________.","song","0.6900","11.00","14","0.66","1.8500","70","10"
"She plays it often because it's her favorite __________.","song","0.5000","11.00","14","0.66","2.1300","70","10"
"The procession slowly advanced as they sang the __________.","song","0.4100","11.00","14","0.66","2.3800","70","10"
"To honor her deceased uncle, the niece sang a __________.","song","0.8100","11.00","14","0.66","1.1500","70","10"
"The confident man claimed he could produce a hit __________.","song","0.5000","11.00","14","0.66","1.9400","70","10"
"For his grandfather's funeral, Oscar composed a __________.","song","0.5400","11.00","14","0.66","2.1600","70","10"
"On the radio, Walter heard a really good __________.","song","0.7600","11.00","14","0.66","1.5000","70","10"
"The little boy's dream was to eventually fly a __________.","plane","0.7600","9.84","10","0.64","1.5100",\N,\N
"They waited for a windy day to use their __________.","kite","0.8600","7.76","25","0.53","0.9600","1","19"
"The strong winds prevented Jillian from flying her __________.","kite","0.9100","7.76","25","0.53","0.5500","1","19"
"It was too windy so Jen reeled in her __________.","kite","0.4500","7.76","25","0.53","2.4000","1","19"
"Inflation caused the cost of living to __________.","raise","0.6800","10.12","37","0.65","1.5700","52","22"
"Ashley went to the department store to buy a __________.","dress","0.3200","9.42","4","0.62","4.0600","67","6"
"Elizabeth went to the mall to buy a new __________.","dress","0.3200","9.42","4","0.62","3.8600","67","6"
"This morning Nina looked very pretty in her silk __________.","dress","0.4700","9.42","4","0.62","2.7400","67","6"
"Despite hours of cleaning, the stain stayed on Grace's white __________.","dress","0.3500","9.42","4","0.62","3.0000","67","6"
"Months before the gala, Avery bought an expensive __________.","dress","0.5200","9.42","4","0.62","2.7500","67","6"
"Stacy was not careful and spilled wine on her __________.","dress","0.4400","9.42","4","0.62","2.6100","67","6"
"His date wouldn't go to prom in her sister's __________.","dress","0.6200","9.42","4","0.62","1.7600","67","6"
"The bride spent weeks shopping for her __________.","dress","0.7000","9.42","4","0.62","1.8400","67","6"
"Jack went to the clothing store to buy a __________.","shirt","0.4500","9.01","15","0.57","2.2900","27","14"
"Reaching for a drink, he got food on his __________.","shirt","0.3400","9.01","15","0.57","2.6400","27","14"
"Conrad had trouble with the button on his __________.","shirt","0.5800","9.01","15","0.57","2.4700","27","14"
"Gavin was frustrated when he got wine on his __________.","shirt","0.6400","9.01","15","0.57","2.1400","27","14"
"The clumsy boy always spilled juice on his __________.","shirt","0.5700","9.01","15","0.57","2.2300","27","14"
"The designer didn't think the model's pants matched the __________.","shirt","0.3800","9.01","15","0.57","2.8300","27","14"
"After the concert the boys each bought a __________.","shirt","0.6400","9.01","15","0.57","2.4400","27","14"
"In the winter the posh woman wore a __________.","coat","0.3300","9.24","26","0.60","3.0000","43","26"
"To stay warm in cold weather, wear a winter __________.","coat","0.8200","9.24","26","0.60","0.8700","43","26"
"The office worker felt confident wearing his new __________.","suit","0.5900","9.81","27","0.65","2.2400","48","24"
"Before leaving the house, the businessman wore a __________.","suit","0.6700","9.81","27","0.65","1.7400","48","24"
"The presidential candidate always wore a simple __________.","suit","0.5600","9.81","27","0.65","2.0500","48","24"
"Mary was upset she spilled coffee on her favorite __________.","blouse","0.3500","7.43","3","0.41","2.8000","1","2"
"During the winter season, Harry always wears a __________.","hat","0.3500","9.37","33","0.61","2.4600","56","31"
"To protect the babies' ears, the mother bought a __________.","hat","0.4300","9.37","33","0.61","3.2900","56","31"
"It was so sunny Kevin needed a __________.","hat","0.7100","9.37","33","0.61","1.8600","56","31"
"Jesse was recognized for always wearing a __________.","hat","0.3500","9.37","33","0.61","3.9800","56","31"
"The thief ran away after taking the woman's __________.","purse","0.9000","7.53","19","0.50","0.7300","14","16"
"Delia needed her keys and rummaged around in her __________.","purse","0.8000","7.53","19","0.50","1.2100","14","16"
"Julie kept her coins in a new leather __________.","purse","0.4500","7.53","19","0.50","1.9800","14","16"
"To hold all her coins Trixie had a small __________.","purse","0.4800","7.53","19","0.50","2.5700","14","16"
"Theo got in trouble for stealing from his mom's __________.","purse","0.6200","7.53","19","0.50","1.8700","14","16"
"Before cooking, the woman had to clean the __________.","stove","0.3200","7.52","6","0.47","3.1400","15","6"
"To cook a meal you will surely need a __________.","stove","0.4400","7.52","6","0.47","2.1700","15","6"
"For her wedding, Linda chose a flowing __________.","gown","0.5900","7.17","10","0.50","1.5600","16","8"
"The woman was overdressed in her fancy __________.","gown","0.3100","7.17","10","0.50","2.9700","16","8"
"The man's girlfriend shrieked when he showed her the __________.","ring","0.4400","10.70","23","0.66","3.3700","49","21"
"In the small town everyone can hear the bell __________.","ring","0.7100","10.70","23","0.66","1.3100","49","21"
"The man bought his girlfriend a diamond __________.","ring","0.9400","10.70","23","0.66","0.4300","49","21"
"In the Wild West, people settled issues with a __________.","gun","0.5000","10.76","24","0.65","1.9900","118","18"
"Before work, the officer had to remember his __________.","gun","0.3500","10.76","24","0.65","3.7400","118","18"
"He heard a noise at midnight and grabbed his __________.","gun","0.6700","10.76","24","0.65","1.7200","118","18"
"When Carl worked in security, he had a __________.","gun","0.5900","10.76","24","0.65","2.0600","118","18"
"Upon returning home, the businessman napped on the __________.","couch","0.6600","8.51","7","0.51","1.6200","12","7"
"After moving into the apartment, Jen bought a new __________.","couch","0.4600","8.51","7","0.51","3.0300","12","7"
"Elsa made some popcorn and sat down on the __________.","couch","0.7500","8.51","7","0.51","1.3400","12","7"
"When Tucker takes a nap he sleeps on the __________.","couch","0.4200","8.51","7","0.51","2.4000","12","7"
"After moving into the apartment, Earl bought a new __________.","couch","0.3300","8.51","7","0.51","3.4200","12","7"
"After washing his hands, Brandon dried them with a __________.","towel","0.9600","8.13","3","0.41","0.3000","6","7"
"When it's chilly, Rachel keeps warm with a furry __________.","blanket","0.4600","8.25","0","0.53","2.9400","30","0"
"At the toy store, the child purchased a new __________.","toy","0.3200","10.13","16","0.61","2.9900","4","10"
"The mountain climbers were excited when they reached the __________.","top","0.4600","11.67","17","0.68","1.7300","204","17"
"The bartender never filled a glass to the __________.","top","0.4300","11.67","17","0.68","1.6800","204","17"
"Bill argued the best mountain view was at the __________.","top","0.4900","11.67","17","0.68","2.8200","204","17"
"The figure skater was spinning like a __________.","top","0.8600","11.67","17","0.68","1.1000","204","17"
"When placed in water, buoyant objects rise to the __________.","top","0.5300","11.67","17","0.68","1.1400","204","17"
"After several hours of climbing they reached the __________.","top","0.4000","11.67","17","0.68","1.8400","204","17"
"It seemed like the girl was always running __________.","late","0.4100","10.92","31","0.69","2.5900","179","26"
"James bought Maggie a watch because she was always __________.","late","0.9000","10.92","31","0.69","0.8000","179","26"
"He was fired due to always being a bit __________.","late","0.7100","10.92","31","0.69","1.9400","179","26"
"Jill is frustrated by people who are always __________.","late","0.7300","10.92","31","0.69","1.8800","179","26"
"The nervous grandmother didn't like to drive too __________.","fast","0.5600","11.25","19","0.67","1.9000","78","13"
"After a long day, Ken just wanted to go __________.","home","0.7400","12.16","20","0.69","1.6300","547","18"
"At the trip's end Madelyn wanted to be __________.","home","0.5200","12.16","20","0.69","2.8200","547","18"
"The impatient mother yells at the child to come __________.","home","0.5600","12.16","20","0.69","1.8500","547","18"
"Jamie wants to clean up before Liz gets __________.","home","0.6300","12.16","20","0.69","1.5800","547","18"
"The tired babysitter just wanted to go __________.","home","0.9400","12.16","20","0.69","0.4600","547","18"
"After the dog ate the trash he began to __________.","vomit","0.5800","7.18","1","0.37","2.6100","1","1"
"Greg clutched his queasy stomach and began to __________.","vomit","0.4700","7.18","1","0.37","3.1900","1","1"
"The stench of the dumpster made the passerby __________.","gag","0.3500","8.06","19","0.55","3.3500","4","19"
"The sight of the vomit caused Courtney to __________.","gag","0.3400","8.06","19","0.55","3.3200","4","19"
"As night fell, all of the dogs began to __________.","howl","0.4400","8.08","24","0.38","1.6000","4","13"
"It frightened the girl scouts when they heard the wolf __________.","howl","0.8700","8.08","24","0.38","0.8500","4","13"
"The dog's teeth were showing as he started to __________.","growl","0.7700","6.42","6","0.29","1.4000","4","6"
"Satisfied with his dinner, Harold let out a huge __________.","burp","0.3600","6.14","14","0.22","2.3100","1","7"
"After eating, it is normal for babies to sometimes __________.","burp","0.5500","6.14","14","0.22","2.1400","1","7"
"After chugging the soda, Peter let out a loud __________.","burp","0.5900","6.14","14","0.22","1.0400","1","7"
"The boy unwrapped the lollipop and started to __________.","lick","0.6300","8.39","30","0.44","1.7800","3","26"
"Paulina gave the huge lollipop a big __________.","lick","0.8800","8.39","30","0.44","0.8300","3","26"
"Ian's favorite pie was either apple or __________.","cherry","0.4300","8.38","16","0.60","2.6800","6","8"
"After the pasta was done, the chef added the __________.","sauce","0.6500","8.66","13","0.56","2.0900","20","8"
"When Kate eats steak she uses a lot of __________.","sauce","0.5400","8.66","13","0.56","2.2000","20","8"
"Heidi loves Georgia, because her favorite fruit is the __________.","peach","0.9300","7.50","25","0.54","0.4800","3","18"
"Fran loved her grandmother's cobblers, and her favorite was __________.","peach","0.5700","7.50","25","0.54","2.0600","3","18"
"Even more than the cookies Davis liked the __________.","cake","0.4600","8.74","24","0.56","3.0700","13","23"
"The squirrel dashed by in order to bury a __________.","nut","0.7700","8.40","27","0.56","1.2400","15","23"
"An almond is a type of seed, not a __________.","nut","0.8700","8.40","27","0.56","0.8400","15","23"
"The driver said the best flavor of pie is __________.","apple","0.4800","11.10","4","0.63","2.6500","9","5"
"Andrew's favorite type of fruit is the __________.","apple","0.3100","11.10","4","0.63","3.6900","9","5"
"Since Jeremy was sick, he stayed in his __________.","bed","0.6400","10.35","29","0.63","1.4300","127","21"
"All Marcus wanted was to stay in his comfy __________.","bed","0.5200","10.35","29","0.63","2.2800","127","21"
"The tired man couldn't wait to get to his __________.","bed","0.4900","10.35","29","0.63","2.7900","127","21"
"Eric couldn't sleep because he didn't like his __________.","bed","0.5700","10.35","29","0.63","2.2600","127","21"
"Martin was so exhausted he fell onto his __________.","bed","0.5600","10.35","29","0.63","2.4700","127","21"
"To sleep well you need a comfortable __________.","bed","0.6900","10.35","29","0.63","1.4200","127","21"
"The spilled juice left a stain on the expensive __________.","carpet","0.3800","9.14","0","0.56","2.9800","13","0"
"After Grace slipped on the floor, she bought a __________.","rug","0.4500","7.28","21","0.38","1.8200","13","20"
"Henry always found his dog lying on the shaggy __________.","rug","0.5200","7.28","21","0.38","1.4600","13","20"
"Drake made a bad shot that barely touched the __________.","rim","0.6300","8.22","28","0.57","2.2100","5","22"
"After standing all day, all he wanted was a __________.","chair","0.3100","9.83","27","0.64","3.1100","66","18"
"The elderly woman needed help standing up from her __________.","chair","0.7800","9.83","27","0.64","1.4200","66","18"
"Jordan learned a lot about cars from his __________.","dad","0.4500","9.38","22","0.59","2.4200","15","18"
"The sick child enjoyed eating the bowl of __________.","soup","0.6100","8.71","17","0.56","2.1500","16","16"
"The chef used his spoon to taste his delicious __________.","soup","0.5700","8.71","17","0.56","2.5300","16","16"
"When her daughter is sick, Michelle makes hot __________.","soup","0.4500","8.71","17","0.56","1.9500","16","16"
"To warm up, Richard enjoyed a bowl of __________.","soup","0.6800","8.71","17","0.56","1.6800","16","16"
"Everyone knows that a cold can be cured with __________.","soup","0.3600","8.71","17","0.56","3.6200","16","16"
"Jerry went to the butcher to buy a fresh __________.","steak","0.3200","7.32","17","0.47","3.5200",\N,\N
"The man went to the butcher to buy some __________.","meat","0.6400","9.61","27","0.62","1.8200","193","22"
"The key to a great burger is good quality __________.","meat","0.5500","9.61","27","0.62","1.3600","193","22"
"Among other things, vegetarians do not eat __________.","meat","0.7000","9.61","27","0.62","1.8300","193","22"
"The toddler enjoyed feeding bread to the fat, white __________.","duck","0.5000","8.83","25","0.60","2.7900","9","22"
"At the nearby pond, Jeremy threw bread for a __________.","duck","0.8700","8.83","25","0.60","0.9600","9","22"
"To avoid hitting her head, she had to __________.","duck","0.8500","8.83","25","0.60","1.0900","9","22"
"Wade spotted the incoming ball and was able to __________.","duck","0.3600","8.83","25","0.60","3.0100","9","22"
"They threw eggs at Barry but he knew to __________.","duck","0.7500","8.83","25","0.60","1.3400","9","22"
"After the boot camp Mark said he'd been through __________.","hell","0.6900","11.04","35","0.63","1.3600","95","24"
"While away at summer camp, Richard slept in a __________.","tent","0.4900","8.07","21","0.57","2.4900","20","17"
"A gas lamp is always a good source of __________.","light","0.8900","11.48","34","0.68","0.6900","333","26"
"The rabbits ate everything growing in Elle's veggie __________.","garden","0.9100","9.33","5","0.66","0.4800","60","1"
"Every day, the family worked in their vegetable __________.","garden","0.8800","9.33","5","0.66","0.7200","60","1"
"Jordan was surprised his dog escaped from the __________.","yard","0.3400","8.91","13","0.61","3.0000","35","10"
"Nadine found it difficult to drive in the __________.","snow","0.4100","9.91","3","0.64","2.4100",\N,\N
"She adores rain but doesn't at all like __________.","snow","0.4200","9.91","3","0.64","3.0400",\N,\N
"The crowded street dispersed due to the cold, falling __________.","snow","0.5300","9.91","3","0.64","1.6100",\N,\N
"Ezra says he's fit but he can't run a __________.","mile","0.8000","9.18","28","0.61","0.9100","48","24"
"The marathon runners struggled through the last __________.","mile","0.6200","9.18","28","0.61","1.8000","48","24"
"Upon the rude princess the witch placed a dark __________.","curse","0.5000","8.95","16","0.58","1.2100","11","14"
"After stubbing her toe, the woman let slip a __________.","curse","0.3700","8.95","16","0.58","3.7200","11","14"
"The teacher taught Brandon a cool new computer __________.","trick","0.4600","9.66","13","0.60","2.4600","15","10"
"To prepare his fields for planting, Blake began to __________.","plow","0.3800","6.64","6","0.38","2.9800",\N,\N
"There is a bit of cyanide in each apple __________.","seed","0.4800","9.01","39","0.61","2.5500",\N,\N
"Ryan wanted an apple tree so he planted a __________.","seed","0.5800","9.01","39","0.61","2.3000",\N,\N
"After spotting the birds, the boy had a mischevious __________.","grin","0.3400","9.08","12","0.34","2.6000","13","9"
"Her parents were dismayed she had pierced her __________.","nose","0.4600","9.54","25","0.61","2.3900","60","15"
"The car door hit Steven's face right in the __________.","nose","0.6200","9.54","25","0.61","2.3000","60","15"
"Despite her parents' wishes, the teenage girl pierced her __________.","nose","0.3800","9.54","25","0.61","2.5100","60","15"
"The fighter's worst injury that night was a broken __________.","nose","0.3800","9.54","25","0.61","3.1300","60","15"
"The big friendly dog wetted her face with his __________.","tongue","0.7000","9.61","15","0.59","1.9200","35","15"
"The soup was extremely hot and burned Matt's __________.","tongue","0.7400","9.61","15","0.59","1.1300","35","15"
"When she was nervous, Frances unconsciously bit her __________.","lip","0.6400","8.11","25","0.56","1.5100","18","23"
"When the boys collided one got a swollen __________.","lip","0.3800","8.11","25","0.56","2.6200","18","23"
"While concentrating, the accountant always bit her __________.","lip","0.7200","8.11","25","0.56","1.4600","18","23"
"Tom went to the hardware store to buy a __________.","hammer","0.5900","8.81","6","0.61","2.5300","9","4"
"Fred opened his toolbox and took out the __________.","hammer","0.5900","8.81","6","0.61","1.9300","9","4"
"The carpenter entered the store to buy a new __________.","hammer","0.5600","8.81","6","0.61","2.2400","9","4"
"For many people, textbooks are a good learning __________.","tool","0.7600","10.41","23","0.64","1.4800","41","20"
"To complete her painting set, Sara bought a new __________.","brush","0.6300","8.65","4","0.57","1.9300","44","4"
"Elle's grandmother applied her face powder using a __________.","brush","0.6500","8.65","4","0.57","1.8400","44","4"
"A black European crow is sometimes called a __________.","raven","0.4200","8.13","3","0.58","3.4600","1","3"
"The farmer used the extra corn he had as __________.","feed","0.5900","9.91","26","0.62","2.8200","123","16"
"The worried mother had many mouths to __________.","feed","0.9600","9.91","26","0.62","0.2700","123","16"
"Andrea watered her garden with a small __________.","hose","0.4500","8.26","29","0.52","2.4500","9","18"
"Fred only criticized Larry to make him feel __________.","bad","0.6000","11.94","28","0.67","2.4900","143","27"
"The health-conscious chef only cooked with meat that was __________.","organic","0.5200","8.62","0","0.62","2.5000","38","0"
"Growing up with three brothers made Maddy __________.","tough","0.4700","9.76","15","0.61","3.4800","36","15"
"She grew up with five brothers so she's pretty __________.","tough","0.6000","9.76","15","0.61","2.8200","36","15"
"Hadley felt her grandfather's passing left a great __________.","void","0.4900","10.04","5","0.57","2.2800","10","2"
"Heartbroken, Toby claimed no one could fill the __________.","void","0.7100","10.04","5","0.57","2.0300","10","2"
"The lawyer shredded the contract after it was declared __________.","void","0.4900","10.04","5","0.57","2.2700","10","2"
"The lawyer found a loophole that made the contract __________.","void","0.5200","10.04","5","0.57","2.1500","10","2"
"Since the child was only seventeen, the contract was __________.","void","0.5600","10.04","5","0.57","1.9600","10","2"
"The information the nurse gave the child had been __________.","wrong","0.3100","11.84","11","0.64","4.2600","129","10"
"The student unfortunately answered the test question __________.","wrong","0.7600","11.84","11","0.64","0.8000","129","10"
"They got lost because the directions were __________.","wrong","0.3300","11.84","11","0.64","3.2400","129","10"
"Sam was late to his meeting because the directions were __________.","wrong","0.3700","11.84","11","0.64","3.2400","129","10"
"Brad was embarrassed when his theory was proven to be __________.","wrong","0.6600","11.84","11","0.64","1.3500","129","10"
"Clara failed to study and got most questions __________.","wrong","0.9700","11.84","11","0.64","0.2400","129","10"
"Brad wasn't completely sure, but something just felt __________.","wrong","0.5700","11.84","11","0.64","1.7100","129","10"
"Fiona couldn't have the bike because it had been __________.","stolen","0.6200","8.91","1","0.62","1.9900","18","0"
"Although beautiful, French is a difficult language to __________.","learn","0.7000","11.18","18","0.65","1.2100","84","14"
"Sharing is an important concept for kids to __________.","learn","0.8900","11.18","18","0.65","0.8500","84","14"
"Pure memorization may not be great method to __________.","learn","0.6300","11.18","18","0.65","1.7400","84","14"
"All the teacher wanted was for the kids to __________.","learn","0.4200","11.18","18","0.65","2.9700","84","14"
"Louis loved going to school, because he loved to __________.","learn","0.7300","11.18","18","0.65","1.6300","84","14"
"Julia couldn't return the dress due to the missing __________.","tag","0.5000","9.94","17","0.60","1.8400","5","20"
"At recess the younger children usually play __________.","tag","0.4200","9.94","17","0.60","3.2100","5","20"
"The kids were exhausted after a long game of __________.","tag","0.3100","9.94","17","0.60","3.4900","5","20"
"After she bought the dress she ripped off its __________.","tag","0.8100","9.94","17","0.60","1.3100","5","20"
"Everyday during recess, the children would play __________.","tag","0.4100","9.94","17","0.60","3.1500","5","20"
"One of the most common recess games is __________.","tag","0.5800","9.94","17","0.60","2.3500","5","20"
"The woman said the blue stone was genuine __________.","sapphire","0.5000","7.95","1","0.45","3.1900","1","1"
"The gemstone in Emma's new ring was green __________.","emerald","0.6400","8.74","0","0.56","2.2900","3","0"
"Thanks to the new alarm system, we could catch the __________.","thief","0.4200","8.36","8","0.57","2.3000","8","8"
"The man embezzled the money and was clearly a __________.","thief","0.4700","8.36","8","0.57","2.4100","8","8"
"The family realized their safe was stolen by a __________.","thief","0.4600","8.36","8","0.57","2.5900","8","8"
"The company boss was suspicious there was a __________.","thief","0.3200","8.36","8","0.57","3.9400","8","8"
"The woman called the pickpocket a dirty __________.","thief","0.5500","8.36","8","0.57","2.6200","8","8"
"Finn returned the lost wallet because he wasn't a __________.","thief","0.7900","8.36","8","0.57","1.2500","8","8"
"They finally solved the case after being given a __________.","clue","0.6500","9.79","12","0.56","1.8000",\N,\N
"Jim felt guilty after he committed a __________.","crime","0.7900","10.42","11","0.66","1.3100","34","8"
"The man was in pain because his arm was __________.","broken","0.6200","10.15","1","0.67","2.4700","63","0"
"Gordon was distraught to discover his wallet was __________.","missing","0.4600","10.51","7","0.66","1.7800","33","2"
"The woman was infuriated to find her luggage was __________.","missing","0.3500","10.51","7","0.66","2.1700","33","2"
"France is a country that is famous for __________.","wine","0.3100","9.48","25","0.64","3.3600","72","26"
"The crowd became rowdy after drinking too much sweet __________.","wine","0.3200","9.48","25","0.64","3.0900","72","26"
"With dinner, Josephine enjoyed a glass of __________.","wine","0.9200","9.48","25","0.64","0.5400","72","26"
"The woman was angry when she spilt her glass of __________.","wine","0.5700","9.48","25","0.64","2.1500","72","26"
"Robert reached into the cabinet for a bottle of __________.","wine","0.3200","9.48","25","0.64","3.5600","72","26"
"The farmers were drunk off the sweet homemade __________.","wine","0.3500","9.48","25","0.64","2.9500","72","26"
"Napa Valley in California is known for making __________.","wine","0.9400","9.48","25","0.64","0.4800","72","26"
"Betty always enjoyed drinking a glass of __________.","wine","0.5100","9.48","25","0.64","2.4300","72","26"
"The festivities ended after one guest drank too much __________.","wine","0.3500","9.48","25","0.64","3.2000","72","26"
"After each day the woman enjoyed her glass of __________.","wine","0.9000","9.48","25","0.64","0.8000","72","26"
"The two young students met and soon fell in __________.","love","1.0000","12.02","9","0.67","0.0000","232","10"
"When she was only twenty years old she found __________.","love","0.4100","12.02","9","0.67","3.3600","232","10"
"The woman said she had finally found __________.","love","0.3600","12.02","9","0.67","3.2100","232","10"
"Carol appreciated her boyfriend's grand gestures of __________.","love","0.5200","12.02","9","0.67","2.7100","232","10"
