"sentence","target word","cloze probability","Log Hal Frequency","Phonological Neighbors","Semantic Neighborhood Density","Response Entropy","densityA","densityB"
"The sailor yelled at his mate to mind the __________.","sails","0.3300","7.16","28","0.56","4.0800",\N,\N
"During the winter these types of animals travel __________.","south","0.5000","11.10","2","0.68","2.4900","240","4"
"To establish a hierarchy, the rooster began to __________.","crow","0.6400","8.45","6","0.59","1.9800","2","10"
"Michael marveled at the wingspan of the __________.","eagle","0.4800","8.83","5","0.63","2.4600","5","5"
"The tennis player tied his opponent, making the score __________.","even","0.7800","13.10","4","0.70","1.5500","1171","1"
"The score of the championship tennis match was __________.","tied","0.5900","9.33","30","0.64","2.5500",\N,\N
"The tennis match became exciting after the score was __________.","tied","0.8600","9.33","30","0.64","0.9200",\N,\N
"Katie didn't know who the present was __________.","for","0.7200","15.42","32","0.70","1.0400","9855","23"
"The teacher asked the child who the gift was __________.","for","0.7900","15.42","32","0.70","0.8000","9855","23"
"Some townspeople believed the proposed law was worth fighting __________.","for","0.7700","15.42","32","0.70","0.9000","9855","23"
"Patrick did not think Kayla was worth fighting __________.","for","0.8000","15.42","32","0.70","1.0100","9855","23"
"James asked for a refund for what he had __________.","bought","0.3900","10.95","30","0.65","2.5100","56","23"
"Sheldon returned from the mall with clothes that he __________.","bought","0.6500","10.95","30","0.65","1.9300","56","23"
"The team was losing and couldn't afford a __________.","loss","0.4100","10.31","17","0.67","3.1600","86","15"
"Paul mispronounced the actor's name and laughed off his __________.","mistake","0.6200","10.14","3","0.60","2.2800","34","0"
"After submitting the paper, Gwen realized she made a __________.","mistake","0.9600","10.14","3","0.60","0.2700","34","0"
"The customer service at this store is hit or __________.","miss","0.9700","10.34","22","0.65","0.2200","258","18"
"Every time the nervous archer shot, she would __________.","miss","0.3900","10.34","22","0.65","3.7500","258","18"
"The archer swore that this time he wouldn't __________.","miss","0.8300","10.34","22","0.65","1.1800","258","18"
"The injured man got stitches to close a large __________.","wound","0.5700","8.72","13","0.60","1.7700","28","10"
"The lotion made Annie break out in a __________.","rash","0.8600","7.73","21","0.48","0.7400","1","20"
"During her allergic reaction, Anne noticed she had a __________.","rash","0.6700","7.73","21","0.48","2.1600","1","20"
"Timmy wore the bandana so long he got a __________.","rash","0.4800","7.73","21","0.48","3.1400","1","20"
"The woman walked with three little children in __________.","tow","0.7000","7.61","34","0.56","1.9500",\N,\N
"The bigger ship had a smaller boat in __________.","tow","0.7600","7.61","34","0.56","1.7100",\N,\N
"The frantic stranded driver called to request a __________.","tow","0.4500","7.61","34","0.56","3.0000",\N,\N
"Before college, the student was afraid that he'd __________.","fail","0.9000","9.84","48","0.62","0.6700","37","33"
"The business owner was scared that his business would __________.","fail","0.7700","9.84","48","0.62","1.4500","37","33"
"Nina had no confidence and always expected to __________.","fail","0.6300","9.84","48","0.62","1.2800","37","33"
"Some people are overconfident and claim they never __________.","fail","0.3100","9.84","48","0.62","3.2200","37","33"
"When Sheldon is upset, others can hear his teeth __________.","grind","0.4500","8.03","5","0.45","2.0500","2","2"
"Paul disliked summer because of the humidity and __________.","heat","0.8900","10.25","29","0.64","0.8100","97","22"
"The man said he fainted because of the __________.","heat","0.6000","10.25","29","0.64","2.3900","97","22"
"Her grandmother told her she was sweet as a __________.","pie","0.3500","8.50","33","0.57","3.9000",\N,\N
"Schnucks was sold-out of milk except for a one gallon __________.","jug","0.5300","6.73","14","0.42","2.5700","6","15"
"The milk was bad so Garrett bought a new __________.","carton","0.3200","6.51","4","0.34","2.4300","1","3"
"The passenger kept yelling at the driver to turn __________.","left","0.4900","11.79","11","0.69","1.5100","480","8"
"Jerry wanted to give the newborn baby its __________.","bottle","0.3600","9.83","10","0.59","2.7900","76","7"
"His mother knew what the baby needed was a __________.","bottle","0.3200","9.83","10","0.59","2.9900","76","7"
"A clumsy toddler, Serena often spilled her __________.","milk","0.3400","9.63","6","0.61","2.4000",\N,\N
"The rancher claimed his cows produced the best __________.","milk","0.8200","9.63","6","0.61","1.0300",\N,\N
"Jacob went to buy a gallon of __________.","milk","0.8100","9.63","6","0.61","1.1500",\N,\N
"At breakfast, her kids really love to drink __________.","milk","0.5800","9.63","6","0.61","1.6300",\N,\N
"The pancake batter had flour, eggs, butter, and __________.","milk","0.4700","9.63","6","0.61","2.1700",\N,\N
"The two young brothers' least favorite drink was __________.","milk","0.3800","9.63","6","0.61","3.4200",\N,\N
"More than anything, the little girl liked to drink __________.","milk","0.3800","9.63","6","0.61","2.7800",\N,\N
"After filling the bowl with cereal, Josh added __________.","milk","0.8700","9.63","6","0.61","0.8000",\N,\N
"The toddler stumbled forward and grabbed the bottle of __________.","milk","0.6300","9.63","6","0.61","2.3000",\N,\N
"For snack, Timmy ate animal crackers and drank __________.","milk","0.6400","9.63","6","0.61","1.5300",\N,\N
"The cows that roam freely make the greatest __________.","milk","0.3200","9.63","6","0.61","3.4400",\N,\N
"That dark red vegetable over there is a __________.","beet","0.4900","6.04","37","0.44","2.2800",\N,\N
"With good oranges and lemons you can make delicious __________.","juice","0.4800","8.94","13","0.56","3.1200","11","11"
"Breaking a mirror will get you years of bad __________.","luck","0.9900","11.01","23","0.60","0.0800","47","23"
"When he made mistakes he said it was bad __________.","luck","0.4200","11.01","23","0.60","3.2200","47","23"
"When eating out, Jasmine preferred to sit at a __________.","booth","0.7100","8.40","15","0.60","1.5400","7","11"
"The tennis player was disappointed he missed on his __________.","serve","0.5400","10.21","11","0.67","2.4300","107","10"
"During the tennis match, Roger returned every __________.","serve","0.6500","10.21","11","0.67","1.8800","107","10"
"The biker fell on his head, damaging his frontal __________.","lobe","0.9300","6.14","14","0.52","0.4900","3","12"
"Rose had sugary to remove the lung's left __________.","lobe","0.4000","6.14","14","0.52","3.1500","3","12"
"The brain surgery entailed removing an entire __________.","lobe","0.3600","6.14","14","0.52","3.0300","3","12"
"The brilliant yet clumsy scientist broke a glass test __________.","tube","0.8400","9.59","10","0.62","1.0500","31","8"
"Most of the young sharks took shelter in the __________.","cove","0.3600","7.04","16","0.58","3.0200","2","17"
"Her favorite place to snorkel was the secret __________.","cove","0.6000","7.04","16","0.58","2.3700","2","17"
"The scuba divers really enjoyed exploring the __________.","reef","0.3200","8.00","22","0.57","2.7800","11","19"
"After eating the peach, the child threw out the __________.","pit","0.7900","9.63","34","0.61","1.1100","14","30"
"Riley ate the peach and then she chucked the __________.","pit","0.7000","9.63","34","0.61","1.5100","14","30"
"After Amy lost her keys, she started to __________.","panic","0.4600","8.79","1","0.59","2.4500","22","0"
"Once lost in the woods, the man started to __________.","panic","0.6500","8.79","1","0.59","2.1900","22","0"
"When he couldn't find his phone, Jim started to __________.","panic","0.6500","8.79","1","0.59","1.9600","22","0"
"Leigh was late to work because she'd lost her __________.","keys","0.7400","10.40","27","0.62","1.5600",\N,\N
"The belt was too small for the customer's __________.","waist","0.9100","8.57","15","0.55","0.5300","46","7"
"Severe joint pain is often a symptom of __________.","arthritis","0.8300","7.42","0","0.57","1.3600","3","0"
"The man had extreme pain in his joints from __________.","arthritis","0.5400","7.42","0","0.57","2.5100","3","0"
"Swimming was a skill that Mike knew he __________.","had","0.4300","13.53","34","0.70","2.7700","5133","28"
"Claire claimed motherhood was the hardest job she ever __________.","had","0.8200","13.53","34","0.70","1.2100","5133","28"
"The little girl wanted the same bicycle her brother __________.","had","0.8500","13.53","34","0.70","1.0100","5133","28"
"Cory opened the door after pulling with all his __________.","might","0.9100","12.53","31","0.69","0.5700","673","24"
"Do not leave the table until everyone is __________.","finished","0.6800","10.05","2","0.65","1.2700",\N,\N
"He had plenty of power at the school as __________.","principal","0.6800","9.13","0","0.67","2.1100","201","0"
"The butterfly is much prettier than the __________.","moth","0.5800","6.24","8","0.51","2.3800","1","7"
"Annoyed by his shirt's holes, Jeff found the pesky __________.","moth","0.5300","6.24","8","0.51","2.9900","1","7"
"The kid gravitated towards the light like a __________.","moth","0.7100","6.24","8","0.51","1.7300","1","7"
"His aunt always said he was strong like a __________.","bull","0.4000","9.03","18","0.63","2.3300","14","12"
"The ranch workers were startled by the charging angry __________.","bull","0.7200","9.03","18","0.63","1.8200","14","12"
"He turned to see the dog charging like a __________.","bull","0.8300","9.03","18","0.63","1.3100","14","12"
"Once outside, the playful toddler started throwing __________.","rocks","0.3700","8.96","15","0.62","3.3900",\N,\N
"Clara got lost because she misread the __________.","directions","0.4200","9.38","0","0.62","1.8100",\N,\N
"Overly cautious, Matt often carried a survival __________.","kit","0.5500","10.12","27","0.61","2.1200","2","28"
"Bobby was building a robot using a modeling __________.","kit","0.3400","10.12","27","0.61","3.5500","2","28"
"It was hard to see because the light was __________.","dim","0.7500","8.36","25","0.49","1.3500","19","20"
"The woman had trouble seeing because the lighting was __________.","dim","0.4400","8.36","25","0.49","2.6000","19","20"
"The doctor couldn't see because the light was too __________.","dim","0.6100","8.36","25","0.49","1.3100","19","20"
"The criminal was nervous to appear before the __________.","judge","0.7700","10.25","4","0.65","0.9000","77","5"
"In the courtroom, the defendant was silenced by the __________.","judge","0.8500","10.25","4","0.65","1.1100","77","5"
"Married to a duchess, Max earned the title of __________.","duke","0.8800","9.40","17","0.64","0.6700","11","14"
"The fashionista's favorite thing to do was __________.","shop","0.5000","10.24","15","0.65","3.1500","63","15"
"Emily enjoys going to malls, because she likes to __________.","shop","0.9400","10.24","15","0.65","0.4800","63","15"
"Ann knew slurping soup loudly was his greatest pet __________.","peeve","1.0000","6.74","19","0.21","0.0000","1","14"
"Incredibly poor food service is my pet __________.","peeve","0.9600","6.74","19","0.21","0.3200","1","14"
"People talking too loudly had always been Lawrence's __________.","peeve","0.3100","6.74","19","0.21","3.7800","1","14"
"Christopher's dream position of power was to be __________.","president","0.6100","11.22","0","0.67","2.6000","382","0"
"The failing college student had to see the __________.","dean","0.3400","9.58","26","0.65","3.6500","40","23"
"A natural leader, Eve was a great hospital __________.","administrator","0.3100","10.06","0","0.60","3.5000","15","0"
"The monk was easily recognized due to wearing a __________.","robe","0.6800","7.40","19","0.47","2.0800","6","15"
"Mike exited the shower and quickly put on his __________.","robe","0.4400","7.40","19","0.47","2.1300","6","15"
"They knew he was a monk because of his __________.","robe","0.5000","7.40","19","0.47","3.0900","6","15"
"After returning to his bedroom, the monk removed his __________.","robe","0.5000","7.40","19","0.47","2.9600","6","15"
"Out of habit, the family always ate dinner at __________.","six","0.4300","10.69","19","0.69","2.8100","220","7"
"The little girl used her fingers to count to __________.","ten","0.6900","10.57","24","0.69","2.0600","0","0"
"The preschoolers were proud that the could count to __________.","ten","0.7300","10.57","24","0.69","1.4800","0","0"
"Stacy had to pick a number between one and __________.","ten","0.6100","10.57","24","0.69","2.4300","0","0"
"Instead of choosing one dog Mark adopted __________.","two","0.5900","13.03","35","0.70","2.0000",\N,\N
"The tourists got lost because they couldn't follow the __________.","map","0.5600","10.16","25","0.64","1.7600","13","20"
"Rachel missed her appointment after writing down the wrong __________.","address","0.3600","12.31","0","0.66","2.0800","77","0"
"The divorced parents spoke cordially for their son's __________.","sake","0.3900","9.35","28","0.57","3.3000","41","23"
"Helen's concerned friend omitted the bad news for her __________.","sake","0.3900","9.35","28","0.57","3.6000","41","23"
"Jack couldn't find Jill even though she was __________.","there","0.3300","14.09","21","0.70","3.7600",\N,\N
"Staring blankly out the window, Nick let his eyes __________.","wander","0.6400","7.83","7","0.47","2.4000","8","5"
"The evil witch eyed the young princess with a __________.","glare","0.3100","6.81","9","0.37","3.7300","7","3"
"The pilot had trouble seeing due to the thick __________.","fog","0.7600","8.47","5","0.57","1.2000","25","9"
"The soldier wasn't sure if the bomb was still __________.","active","0.5300","10.48","2","0.68","2.2800","88","1"
"The kind grandmother told stories while she __________.","knitted","0.3700","5.39","8","0.37","3.0900",\N,\N
"Frank read by the fireplace while his grandmother __________.","knitted","0.4000","5.39","8","0.37","2.7300",\N,\N
"The mechanic lifts cars using a car __________.","jack","0.5900","10.36","24","0.67","2.0400","92","16"
"In card decks, the lowest face card is the __________.","jack","0.5900","10.36","24","0.67","2.1300","92","16"
"Rick always felt truly better after doing a good __________.","deed","0.3800","7.59","28","0.55","2.2100","8","17"
"Mario legally owned the property according to the __________.","deed","0.3800","7.59","28","0.55","3.8300","8","17"
"The brave fireman was rewarded for his heroic __________.","deed","0.3700","7.59","28","0.55","3.0900","8","17"
"The apples on the tree were too high to __________.","reach","0.6500","10.44","21","0.67","1.0000","106","17"
"The bulletin board was low enough for Tom to __________.","reach","0.6400","10.44","21","0.67","2.0300","106","17"
"The toddler jumped but the jar was out of __________.","reach","0.8200","10.44","21","0.67","1.2600","106","17"
"The cookie container was just barely out of __________.","reach","0.6300","10.44","21","0.67","1.6200","106","17"
"The ringing phone was too far for Ethan to __________.","reach","0.5000","10.44","21","0.67","2.1400","106","17"
"The political boss gave him some cash as a __________.","bribe","0.5700","7.02","5","0.48","2.1700","1","5"
"The store clerk ended up being an unknowing __________.","accomplice","0.3700","5.64","1","0.49","3.6300","2","0"
"The accused criminal was served with a __________.","warrant","0.4400","8.78","2","0.58","2.4000","20","1"
"The seamstress went to the market to buy a __________.","needle","0.3900","8.53","6","0.56","3.7200","15","5"
"At the beach Sammy's sandwich was snatched by a __________.","seagull","0.5600","6.29","0","0.36","2.4000",\N,\N
"The boy's father called the white sea bird a __________.","gull","0.3500","5.64","20","0.44","3.2000","1","17"
"When her boyfriend cheated Kay said she was __________.","done","0.3100","12.07","35","0.69","3.9400","321","29"
"Brie cut the steak to see if it was __________.","done","0.7400","12.07","35","0.69","1.4100","321","29"
"Swimming is one of the hardest skills to __________.","master","0.5600","10.90","8","0.68","1.3800","72","4"
"Brad's family missed him after he was gone a __________.","while","0.3600","12.56","8","0.70","2.5300","680","5"
"After winning the lottery, Cole was excited to be __________.","rich","0.8900","10.51","23","0.67","0.8400","74","20"
"Yolanda wants a great job so she can get __________.","rich","0.3700","10.51","23","0.67","3.3100","74","20"
"Shawn hoped winning the lottery would make him __________.","rich","0.7300","10.51","23","0.67","1.3700","74","20"
"The businessman's goal was to be powerful and __________.","rich","0.5900","10.51","23","0.67","2.2500","74","20"
"The road glistened when it was covered in __________.","ice","0.3600","10.55","15","0.66","2.5100","45","7"
"Paige injured her back when she slipped outside on __________.","ice","0.7700","10.55","15","0.66","1.6300","45","7"
"All the queen's loyal servants responded to her every __________.","whim","0.4000","7.39","7","0.36","2.6400","2","8"
"Listen\"\" was the toddler's most commonly used __________.","word","0.7700","11.84","23","0.67","1.4700","274","18"
"Phil called a landscaper, because they needed someone to __________.","mow","0.4400","6.64","31","0.25","3.2400","1","17"
"Beth hasn't figure out the solution, but Martha __________.","has","0.7200","13.98","25","0.70","1.0800","2439","18"
"Marco is usually happy with what he __________.","has","0.3400","13.98","25","0.70","3.5100","2439","18"
"Dan has never been to Europe, but Mira __________.","has","0.7100","13.98","25","0.70","1.2000","2439","18"
"The beautiful view was obscured by the __________.","trees","0.3900","9.60","11","0.64","3.0100",\N,\N
"The penguins enjoyed sliding down the slope of a __________.","hill","0.3800","10.35","40","0.67","2.8500","72","31"
"Richard supported the Cardinals by wearing a __________.","jersey","0.4600","9.64","3","0.65","2.1800","25","1"
"Her left hand was freezing after she lost her __________.","glove","0.8000","7.76","2","0.54","1.0500","9","2"
"The baseball player always used his lucky catcher's __________.","mitt","0.9100","5.09","31","0.37","0.5700","1","27"
"Grandma said you couldn't use the oven without a __________.","mitt","0.5400","5.09","31","0.37","2.9300","1","27"
"The doctor informed her he had found a __________.","tumor","0.5000","7.33","9","0.58","2.0800","17","3"
"After a hard workday, James liked drinking a cold __________.","beer","0.9200","10.12","40","0.62","0.5600","34","26"
"Jeremy enjoyed drinking his glass of cold __________.","beer","0.4400","10.12","40","0.62","2.5500","34","26"
"The couple began to brew their own __________.","beer","0.6200","10.12","40","0.62","1.5000","34","26"
"Bradley's wife told him not to drink too much __________.","beer","0.3600","10.12","40","0.62","2.7600","34","26"
"Nina was upset that her nail polish had already started to __________.","chip","0.5900","10.48","22","0.61","2.1000","17","22"
"The workout was so hard that it made me __________.","sweat","0.4000","8.53","6","0.53","3.3500","23","5"
"Melanie loved working out, but hated the __________.","sweat","0.5000","8.53","6","0.53","2.8500","23","5"
"The farmer saw that his chickens had left the __________.","coop","0.7000","6.75","13","0.56","1.9000","3","15"
"The chickens hated when they were put in their __________.","coop","0.4200","6.75","13","0.56","2.0800","3","15"
"The farmer discovered that the chickens escaped from the __________.","coop","0.6400","6.75","13","0.56","1.6800","3","15"
"The farmer collected wood to build a new __________.","barn","0.3200","7.85","11","0.58","3.0500","29","10"
"The helpless field mouse was swooped up by the __________.","hawk","0.4600","8.19","16","0.59","2.2000","14","14"
"The large bird that soared overhead was a __________.","hawk","0.3200","8.19","16","0.59","3.2900","14","14"
"Ryan's pet snake was sleeping in a tight __________.","coil","0.4600","8.13","15","0.56","2.6200","6","16"
"The preschooler tied his shoelaces with an extra __________.","knot","0.6800","7.60","29","0.54","1.8100","4617","27"
"The ribbons were a mess and in one big __________.","knot","0.3200","7.60","29","0.54","2.8800","4617","27"
"Nobody there could undo such a tight __________.","knot","0.8600","7.60","29","0.54","1.1400","4617","27"
"Everyone was shocked when the couple broke up so __________.","quickly","0.3900","10.65","0","0.69","2.3700",\N,\N
"She comforted the woman and said help would come __________.","soon","0.8100","11.41","26","0.69","1.4100","199","21"
"With one minute left, James knew the game would end __________.","soon","0.4200","11.41","26","0.69","2.4100","199","21"
"Mary will complete her lengthy capstone project __________.","soon","0.3300","11.41","26","0.69","2.8900","199","21"
"The ugly bird had trouble finding a __________.","mate","0.5700","8.55","39","0.60","2.0700","21","26"
"During this season the adult deer usually __________.","mate","0.5600","8.55","39","0.60","2.8200","21","26"
"In hyena packs the females select a male __________.","mate","0.6200","8.55","39","0.60","2.1400","21","26"
"In the spring, many animals begin to __________.","mate","0.5700","8.55","39","0.60","2.7700","21","26"
"The toddler joined the puppy in playing __________.","fetch","0.3600","8.07","6","0.46","2.8600","6","8"
"The energetic little puppy loves to play __________.","fetch","0.5200","8.07","6","0.46","2.3800","6","8"
"Their dog Roxy actually hates to play __________.","fetch","0.6400","8.07","6","0.46","1.8800","6","8"
"His aunt would not come because his house is __________.","messy","0.3200","7.80","10","0.40","3.1900",\N,\N
"After soccer practice, Logan threw his clothes in the __________.","washer","0.4200","6.92","1","0.36","2.4400","2","2"
"The British businessman was the wealthiest in the whole __________.","country","0.3600","11.58","0","0.69","2.8600","324","0"
"Erin watered her lawn because the grass was __________.","brown","0.4600","10.65","9","0.68","1.7600","176","8"
"Always full of energy, Wilson never seemed to __________.","tire","0.5100","8.73","26","0.57","2.5800","22","22"
"Gabe went to the automobile shop to replace a __________.","tire","0.4200","8.73","26","0.57","3.3500","22","22"
"After three hours of hiking, the campers began to __________.","tire","0.6000","8.73","26","0.57","2.5800","22","22"
"He was late because he had gotten a flat __________.","tire","0.9900","8.73","26","0.57","0.0800","22","22"
"After driving over sharp glass, Ronald had a flat __________.","tire","1.0000","8.73","26","0.57","0.0000","22","22"
"Riley was unhappy that her new pants were __________.","tight","0.3800","9.87","34","0.61","3.5500","28","25"
"Due to heavy rainfall, the rainforest is very __________.","wet","0.4200","9.71","22","0.61","2.9000","53","22"
"Helen fell in the bathroom, because the floor was __________.","wet","0.4600","9.71","22","0.61","1.4800","53","22"
"Natalie covered her head to avoid getting her hair __________.","wet","0.8100","9.71","22","0.61","1.2100","53","22"
"After Chris dropped bread in the water, it became __________.","soggy","0.7800","5.94","3","0.24","1.5800","3","3"
"The basketball player enjoyed meeting the supportive __________.","fans","0.5800","10.36","15","0.66","2.0900",\N,\N
"The couple worked well together and made a perfect __________.","team","0.3300","11.60","22","0.67","2.5300","83","17"
"To start the Sumo match they struck a large __________.","gong","0.7200","6.92","13","0.56","1.6200","1","12"
"Abby stuck his picture to her wall with a __________.","tack","0.4600","7.38","29","0.38","2.3500","4","27"
"Frankie had four plants getting sunned on the __________.","porch","0.5200","7.43","10","0.56","2.5200","43","5"
"After the rain stopped, Caroline played outside in the __________.","puddles","0.5600","5.76","3","0.27","2.1200",\N,\N
"The minor damage to their car was from __________.","hail","0.6300","8.08","41","0.55","2.7200","12","26"
"His mother cautioned him about letting the bananas __________.","rot","0.3800","7.77","33","0.48","2.5900","8","26"
"Terry told Jay the old fruit had begun to __________.","rot","0.7600","7.77","33","0.48","1.5300","8","26"
"The green fuzz indicated the food had started to __________.","mold","0.6100","8.23","17","0.56","1.7600","45","14"
"The sandwich left under Henry's bed started to __________.","mold","0.3500","8.23","17","0.56","2.3700","45","14"
"Lindsay stored her homemade lemonade in a __________.","pitcher","0.3600","7.36","5","0.57","2.5300","21","1"
"It seemed like the accident shook her to the __________.","core","0.8400","9.89","31","0.67","0.7700","146","26"
"He ate every part of the fruit except the __________.","core","0.3300","9.89","31","0.67","2.4200","146","26"
"The award-winning pizza had a delicious and soft __________.","crust","0.9100","7.30","7","0.55","0.6200","1","4"
"The picky child refused to eat the sandwich's __________.","crust","0.7400","7.30","7","0.55","1.6400","1","4"
"The committed scientist spent hours working in the __________.","lab","0.8800","10.12","19","0.62","0.8200","3","18"
"Shelly wanted to be a scientist working at a __________.","lab","0.7200","10.12","19","0.62","1.6500","3","18"
"Each day, several research studies are run at the __________.","lab","0.3500","10.12","19","0.62","2.6700","3","18"
"Instead of buying a new phone, Shannon replaced the __________.","battery","0.3600","10.22","0","0.62","3.5500","18","0"
"The new accusations cast a lot of __________.","doubt","0.7400","10.79","15","0.63","1.8300","114","17"
"The confident man believed he was right without a __________.","doubt","0.4900","10.79","15","0.63","2.9400","114","17"
"They knew she was a hiker because of her __________.","boots","0.3600","9.28","16","0.58","3.6000",\N,\N
